"奥義ID","奥義名","奥義種別","消費攻撃ゲージ","消費奥義ゲージ","効果量","フレーバー","対応ギアメモ","メモ","","","","","","","","","","","","","","","","","","","","","","",""
"h001","コズミック・アタック","1","70","60","200","青い光跡を描きながらスタジアムを突撃し、敵の重心を激しく揺さぶる。","コズミック・ドラゴン","攻撃弱","","","","","","","","","","","","","","","","","","","","","","",""
"h002","ギャラクシー・フレア","2","100","80","280","銀河の渦のような回転エネルギーを放ち、大爆発でスタジアムの外へ吹き飛ばす。","コズミック・ドラゴン","攻撃強","","","","","","","","","","","","","","","","","","","","","","",""
"h003","スターダスト・シールド","3","0","40","70","星屑のような電磁障壁で身を包み、敵からの被突進ダメージを大幅にカットする。","コズミック・ドラゴン","防御","","","","","","","","","","","","","","","","","","","","","","",""
"h004","コスモ・カウンター","5","70","60","200","敵の突進ベクトルを超重力で歪め、そのまま外周方向へ強烈にノックバックさせる。","コズミック・ドラゴン","カウンター","","","","","","","","","","","","","","","","","","","","","","",""
"h005","ライトニング・エッジ","1","70","60","200","稲妻のごときジグザグの超高速軌道で接近し、一撃で敵のブレードの隙間を切り裂く。","ミラージュ・ペガサス","攻撃弱","","","","","","","","","","","","","","","","","","","","","","",""
"h006","サンダーストライク","2","100","80","280","落雷を伴う超急降下体当たりを敢行し、激突面から火花を散らして大ダメージを与える。","ミラージュ・ペガサス","攻撃強","","","","","","","","","","","","","","","","","","","","","","",""
"h007","ボルト・ステップ","4","0","40","60","瞬間的な放電加速によって真横へスライドし、敵の正面突撃を完全に回避する。","ミラージュ・ペガサス","回避","","","","","","","","","","","","","","","","","","","","","","",""
"h008","スパーキング・リベンジ","5","70","60","200","激突の瞬間、高圧電流をスタジアムにアースさせ、反発力で相手を力強く跳ね返す。","ミラージュ・ペガサス","カウンター","","","","","","","","","","","","","","","","","","","","","","",""
"h009","インフェルノ・ファング","1","70","60","200","激しい超高速回転による摩擦でボディを赤熱化させ、触れた敵を焼き削るように強襲する。","チェイン・ケルベロス","攻撃弱","","","","","","","","","","","","","","","","","","","","","","",""
"h010","プロミネンス・ノヴァ","2","100","80","280","すべてのエネルギーを激突の瞬間に大爆発させ、アリーナ全体を震わせる必殺の一撃。","チェイン・ケルベロス","攻撃強","","","","","","","","","","","","","","","","","","","","","","",""
"h011","マグマ・ウォール","3","0","40","70","周囲の空気を加熱し、上昇する熱気の壁によって敵の接近突撃の威力を減衰させる。","チェイン・ケルベロス","防御","","","","","","","","","","","","","","","","","","","","","","",""
"h012","フレア・バースト","5","70","60","200","激突の反動力をボディ内部の燃焼ガスでブーストし、強力な爆発カウンターを見舞う。","チェイン・ケルベロス","カウンター","","","","","","","","","","","","","","","","","","","","","","",""
"h013","アクア・ストリーム","1","70","60","200","しなやかな水流の軌道で接近し、敵の重心を滑らせてスタミナを吸い取るように削る。","アビス・クラーケン","攻撃弱","","","","","","","","","","","","","","","","","","","","","","",""
"h014","ハイドロ・カノン","2","100","80","280","高圧の水流を噴射するような勢いで突撃し、敵をアリーナ端まで一気に押し出す。","アビス・クラーケン","攻撃強","","","","","","","","","","","","","","","","","","","","","","",""
"h015","タイダル・ウォール","3","0","40","70","激しい水流のカーテンをスタジアムに発生させ、敵の突撃衝撃を綺麗に受け流す。","アビス・クラーケン","防御","","","","","","","","","","","","","","","","","","","","","","",""
"h016","ヴォルテックス・フォース","5","70","60","200","渦潮のような受け流し軌道から、敵の遠心力を利用してスタジアム外へと放り投げる。","アビス・クラーケン","カウンター","","","","","","","","","","","","","","","","","","","","","","",""
"h017","アース・クエイク","1","70","60","200","大地の揺れを伴う重低音のスピンで敵の進路を塞ぎ、強烈なボディプレスを繰り出す。","ソリッド・ゴーレム","攻撃弱","","","","","","","","","","","","","","","","","","","","","","",""
"h018","ギガント・クラッシュ","2","100","80","280","自重を一時的に倍増させて急降下し、大地震のごとき衝撃でアリーナ全域を吹き飛ばす。","ソリッド・ゴーレム","攻撃強","","","","","","","","","","","","","","","","","","","","","","",""
"h019","ストーン・フォートレス","3","0","40","70","岩石の如き絶対防壁を張り巡らせ、敵のいかなる鋭い打撃も平然と受け止める。","ソリッド・ゴーレム","防御","","","","","","","","","","","","","","","","","","","","","","",""
"h020","グランド・ストーン","5","70","60","200","激突された衝撃をアース（吸収）し、蓄積した反動力をそのまま重量級カウンターで返す。","ソリッド・ゴーレム","カウンター","","","","","","","","","","","","","","","","","","","","","","",""
"h021","ヘビー・ビート","1","70","60","200","カブトホーンを模した突起で敵のアンダーボディを突き上げ、体制を上に浮かせる。","メタル・ギガント","攻撃弱","","","","","","","","","","","","","","","","","","","","","","",""
"h022","ギガ・ホーン・ラッシュ","2","100","80","280","強靭な大顎で挟み込むかのような、左右からの強烈な挟撃アタックで粉砕する。","メタル・ギガント","攻撃強","","","","","","","","","","","","","","","","","","","","","","",""
"h023","アイアン・シェル","3","0","40","70","頑強な甲殻のような電磁シェルをまとい、受けるあらゆる打撃の衝撃を半減させる。","メタル・ギガント","防御","","","","","","","","","","","","","","","","","","","","","","",""
"h024","ホーン・フォース","5","70","60","200","甲羅にこもるように敵の突進を受け止め、頑強なホーンで突き返すカウンターを放つ。","メタル・ギガント","カウンター","","","","","","","","","","","","","","","","","","","","","","",""
"h025","メテオ・ストライク","1","70","60","200","流星のような超高速の光跡となって突っ込み、敵の側面に高速で接触して削り取る。","ソニック・イーグル","攻撃弱","","","","","","","","","","","","","","","","","","","","","","",""
"h026","スターライト・フォール","2","100","80","280","流星群が降り注ぐかのような無数の超高速微細打撃をアリーナ全体に叩き込む。","ソニック・イーグル","攻撃強","","","","","","","","","","","","","","","","","","","","","","",""
"h027","ソニック・ステップ","4","0","40","60","ソニックブームを伴う超高速移動で、敵の射程から一瞬で離脱して攻撃をかわす。","ソニック・イーグル","回避","","","","","","","","","","","","","","","","","","","","","","",""
"h028","ファルコン・カウンター","5","70","60","200","敵の突撃を音速のサイドステップでかわし、すれ違いざまに音速の反撃を見舞う。","ソニック・イーグル","カウンター","","","","","","","","","","","","","","","","","","","","","","",""
"h029","シャドウ・ストライク","1","70","60","200","影のように視界から消え、次の瞬間には背後から刃を滑り込ませるような急襲をかける。","シャドウ・スペクター","攻撃弱","","","","","","","","","","","","","","","","","","","","","","",""
"h030","ナイトメア・レイド","2","100","80","280","悪夢のような闇のオーラを放ちながら、相手の死角から最大出力のアタックを叩き込む。","シャドウ・スペクター","攻撃強","","","","","","","","","","","","","","","","","","","","","","",""
"h031","ダークネス・ステップ","4","0","40","60","分身するかのような残像ステップを繰り出し、敵のアタックをスカらせて無効化する。","シャドウ・スペクター","回避","","","","","","","","","","","","","","","","","","","","","","",""
"h032","ヘル・カウンター","5","70","60","200","攻撃を受けた瞬間に影武者のように入れ替わり、背後から急襲カウンターを浴びせる。","シャドウ・スペクター","カウンター","","","","","","","","","","","","","","","","","","","","","","",""
"h033","ブラスト・ダイブ","1","70","60","200","急降下爆撃のごとき強烈な角度で敵のブレード天面に激突し、姿勢を激しく崩させる。","ブラスト・ワイバーン","攻撃弱","","","","","","","","","","","","","","","","","","","","","","",""
"h034","ワイバーン・ストーム","2","100","80","280","軍用のリミッターを完全カットし、スタジアムが崩壊するほどの超音速突進を敢行する。","ブラスト・ワイバーン","攻撃強","","","","","","","","","","","","","","","","","","","","","","",""
"h035","ウインド・ステップ","4","0","40","60","ジェット噴射による瞬間的なスライド移動で、敵の突撃線を完全に置き去りにする。","ブラスト・ワイバーン","回避","","","","","","","","","","","","","","","","","","","","","","",""
"h036","ドラゴニック・カウンター","5","70","60","200","激突と同時に軍用ジェットカウンターを発動し、目にも留らぬ速さで敵を弾き飛ばす。","ブラスト・ワイバーン","カウンター","","","","","","","","","","","","","","","","","","","","","","",""
"h037","シザース・カット","1","70","60","200","クワガタのダブルシザーのように、敵を挟み込んで左右から連続でスライスする。","ルイン・デスサイズ","攻撃弱","","","","","","","","","","","","","","","","","","","","","","",""
"h038","double・クロー・インパクト","2","100","80","280","強烈な一対の鋏で挟んでアリーナ中央から力ずくで投げ飛ばす必殺アタック。","ルイン・デスサイズ","攻撃強","","","","","","","","","","","","","","","","","","","","","","",""
"h039","シスル・ステップ","4","0","40","60","クワガタの素早い横歩きステップを模した挙動で、敵の突撃をヒラリとかわす。","ルイン・デスサイズ","回避","","","","","","","","","","","","","","","","","","","","","","",""
"h040","チェイン・カウンター","5","70","60","200","敵の攻撃を鋏でガッチリ受け止め、強烈なバネの力で逆方向に跳ね返す。","ルイン・デスサイズ","カウンター","","","","","","","","","","","","","","","","","","","","","","",""
"h041","フロスト・バイト","1","70","60","200","冷気によってスタジアムの摩擦を極限までゼロにし、滑るように敵の側面を鋭く削る。","スラッシュ・フェンリル","攻撃弱","","","","","","","","","","","","","","","","","","","","","","",""
"h042","ブリザード・ゲイル","2","100","80","280","凍てつく絶対零度の吹雪を伴いながら突進し、敵のスピードとスタミナを奪い取る大技。","スラッシュ・フェンリル","攻撃強","","","","","","","","","","","","","","","","","","","","","","",""
"h043","アイス・ウォール","4","0","40","60","氷壁をスタジアムに急造し、近づく敵の回転速度を冷気で鈍らせながら防ぐ。","スラッシュ・フェンリル","回避","","","","","","","","","","","","","","","","","","","","","","",""
"h044","ゼロ・リベンジ","5","70","60","200","激突された衝撃を瞬時にフリーズ（相殺）し、冷気の炸裂とともにカウンターを叩き込む。","スラッシュ・フェンリル","カウンター","","","","","","","","","","","","","","","","","","","","","","",""
"h045","ヴァルキリー・ストライク","1","70","60","200","戦乙女の槍の如く鋭く突進し、敵の防御の隙間を容赦なく撃ち抜く！","ファントム・ヴァルキリー","攻撃弱","","","","","","","","","","","","","","","","","","","","","","",""
"h046","ファントム・ブレイカー","2","100","80","280","幻影をまとって死角から急加速し、最大パワーで相手を壁際まで叩き潰す！","ファントム・ヴァルキリー","攻撃強","","","","","","","","","","","","","","","","","","","","","","",""
"h047","ヴァルキリー・ステップ","4","0","40","60","勝気な笑みを浮かべながら真横へスライドし、敵の正面突撃を完全にスカらせる！","ファントム・ヴァルキリー","回避","","","","","","","","","","","","","","","","","","","","","","",""
"h048","ヴァルキリー・ストライクバック","5","70","60","200","敵の攻撃をギリギリでいなし、槍の突き出し（ストライク）をそのまま力強く撃ち返す！","ファントム・ヴァルキリー","カウンター","","","","","","","","","","","","","","","","","","","","","","",""
"h049","テイル・スティンガー","1","70","60","200","サソリの針のごとき鋭い毒針アタックで、敵のボディに深い傷（持続スタミナ減少）を与える。","カース・スフィンクス","攻撃弱","","","","","","","","","","","","","","","","","","","","","","",""
"h050","ポイズン・バースト","2","100","80","280","尾の強烈な一撃を叩き込み、敵のギアの駆動部を一時的にマヒ（スピード大幅低下）させる。","カース・スフィンクス","攻撃強","","","","","","","","","","","","","","","","","","","","","","",""
"h051","アシッド・シールド","3","0","40","70","酸性障壁を張り、接触した敵の攻撃力を腐食させて威力を弱める。","カース・スフィンクス","防御","","","","","","","","","","","","","","","","","","","","","","",""
"h052","マンティコア・タスク","5","70","60","200","激突の瞬間、毒針で敵を突き刺すような軌道でカウンターを放ち、大きくノックバックさせる。","カース・スフィンクス","カウンター","","","","","","","","","","","","","","","","","","","","","","",""
"h053","ブレイズ・スラッシュ","1","70","60","200","不規則なブレを意図的に引き起こし、相手の予測を外す多段ヒット打撃を浴びせる。","ミラージュ・ファルコン","攻撃弱","","","","","","","","","","","","","","","","","","","","","","",""
"h054","カオス・イグニッション","2","100","80","280","混沌とした魔獣の炎をまとって突撃し、アタック成功時に追加の爆発ダメージを与える。","ミラージュ・ファルコン","攻撃強","","","","","","","","","","","","","","","","","","","","","","",""
"h055","キメラ・ガード","3","0","40","70","魔獣の実体のような多重の障壁を張り、被ダメージのバラつきを抑えて耐え凌ぐ。","ミラージュ・ファルコン","防御","","","","","","","","","","","","","","","","","","","","","","",""
"h056","ビースト・カウンター","5","70","60","200","敵の攻撃を受けた瞬間に鋭い噛みつきのような軌道でカウンターを撃ち返す。","ミラージュ・ファルコン","カウンター","","","","","","","","","","","","","","","","","","","","","","",""
"h057","アビス・ニードル","1","70","60","200","無数の触手のような不気味な軌道でしつこく接触し、敵のスタミナをドレインする。","ソニック・ジャガー","攻撃弱","","","","","","","","","","","","","","","","","","","","","","",""
"h058","ジェイド・カタストロフ","2","100","80","280","大王イカが獲物を丸呑みにするかのように、アリーナ全体を巻き込む大渦アタックを放つ。","ソニック・ジャガー","攻撃強","","","","","","","","","","","","","","","","","","","","","","",""
"h059","クラーケン・ガード","3","0","40","70","深海の粘り気のある水流シールドで身を包み、被弾の衝撃を完全に吸収・減衰する。","ソニック・ジャガー","防御","","","","","","","","","","","","","","","","","","","","","","",""
"h060","ディープ・リベンジ","5","70","60","200","敵の突撃を深海の粘性で絡め取り、粘り強い反動カウンターで相手を押し戻す。","ソニック・ジャガー","カウンター","","","","","","","","","","","","","","","","","","","","","","",""
"h061","タイガー・クロー","1","70","60","200","アサルトアセンブルによる猛烈な2連爪撃アタック！","アサルト_タイガー","攻撃弱","","","","","","","","","","","","","","","","","","","","","","",""
"h062","アサルト_ストライク","2","100","80","280","スタジアム中央から外周の敵へ一直線に叩き込む強襲突進！","アサルト_タイガー","攻撃強","","","","","","","","","","","","","","","","","","","","","","",""
"h063","アイアン・シールド","3","0","40","70","重厚なアサルトプレートを全面に押し出し、敵の強撃を防御！","アサルト_タイガー","防御","","","","","","","","","","","","","","","","","","","","","","",""
"h064","タイガー・インフェルノ","5","70","60","200","激突の瞬間、虎が獲物を襲う如き猛アタックに転じてスタジアムを割る！","アサルト_タイガー","カウンター","","","","","","","","","","","","","","","","","","","","","","",""
"h065","ハリケーン・スラッシュ","1","70","60","200","風刃をまとった高速スピンで相手の側面に何度も接触し、スタミナを細かく削り取る。","テンペスト・グリフォン","攻撃弱","","","","","","","","","","","","","","","","","","","","","","",""
"h066","テンペスト・レイジ","2","100","80","280","局所的な大竜巻をスタジアム中央に発生させ、上昇気流で敵のギアを大きく跳ね上げる。","テンペスト・グリフォン","攻撃強","","","","","","","","","","","","","","","","","","","","","","",""
"h067","ウィンド・ステップ","4","0","40","60","気流のクッションを利用してスタジアム外周へ逃れ、敵の攻撃軸から身をかわす。","テンペスト・グリフォン","回避","","","","","","","","","","","","","","","","","","","","","","",""
"h068","サイクロン・カウンター","5","70","60","200","突進の衝撃を風圧の渦で綺麗にいなし、カウンターの突風で敵を場外方向へ押し戻す。","テンペスト・グリフォン","カウンター","","","","","","","","","","","","","","","","","","","","","","",""
"h069","グラビティ・ブレイク","1","70","60","200","局所的な重力歪みを生み出し、敵のギアを真下へ押し潰すように拘束してアタックする。","グラビティ・フェニックス","攻撃弱","","","","","","","","","","","","","","","","","","","","","","",""
"h070","コズミック・メテオ","2","100","80","280","重力加速によって彗星のごとき超スピードを得て突撃し、スタジアムを粉砕する大技。","グラビティ・フェニックス","攻撃強","","","","","","","","","","","","","","","","","","","","","","",""
"h071","ブラックホール・シールド","3","0","40","70","極小のブラックホールのような重力障壁を作り出し、受けるダメージをほぼ完全に吸収する。","グラビティ・フェニックス","防御","","","","","","","","","","","","","","","","","","","","","","",""
"h072","グラビティ・シフト","4","0","40","60","重力の向きを瞬間的にシフトさせることで軌道を反らし、敵の強撃を完全に回避する。","グラビティ・フェニックス","回避","","","","","","","","","","","","","","","","","","","","","","",""
"h073","レオ・ゴールドラッシュ","1","70","60","200","黄金のライオンが獲物を仕留めるかのように、極限の牙で連続かつ猛烈に噛み付く。","レオ・ゴールドファング","攻撃弱","","","","","","","","","","","","","","","","","","","","","","",""
"h074","レオ・インフィニティクラッシュ","2","100","80","280","アーサーのレオ専用極大奥義。スタジアムを真っ二つにする破壊的な超黄金突進。","レオ・ゴールドファング","攻撃強","","","","","","","","","","","","","","","","","","","","","","",""
"h075","レオ・スピードステップ","4","0","40","60","目にも留らぬスピードステップを連続で踏み、アリーナのどこにも実体を残さず回避する。","レオ・ゴールドファング","回避","","","","","","","","","","","","","","","","","","","","","","",""
"h076","レオ・チェインカウンター","5","70","60","200","敵が触れた瞬間に超高速のチェイン（爪撃）を浴びせる反撃。","レオ・ゴールドファング","カウンター","","","","","","","","","","","","","","","","","","","","","","",""
"h077","カイザー・インパクト","1","70","60","200","絶対王者の覇気をもってアリーナ中央から重厚な突撃を敢行し、敵を力で屈服させる。","カイザー・ジェネシス","攻撃弱","","","","","","","","","","","","","","","","","","","","","","",""
"h078","カイザー_インフィニティノヴァ","2","100","80","280","店長のカイザー専用極大奥義。全アリーナの空気を震わせる、天変地異のごとき絶対の一撃。","カイザー・ジェネシス","攻撃強","","","","","","","","","","","","","","","","","","","","","","",""
"h079","カイザー・マジェスティ・バリア","3","0","40","70","カイザーの絶対城塞を展開し、受けるダメージをほぼ完全にゼロにシャットアウトする。","カイザー・ジェネシス","防御","","","","","","","","","","","","","","","","","","","","","","",""
"h080","カイザー・エンド・ジェネシス","4","0","40","60","皇帝の領域。あらゆる敵の追撃を軽やかに無効化し、アリーナ中央で悠然と回り続ける。","カイザー・ジェネシス","回避","","","","","","","","","","","","","","","","","","","","","","",""
